Section,Division,Group,Class,Subclass,Description
G,46,463,46338,4633803,Wholesale trade in rabbits and other small live animals for animal feeding
G,46,463,46346,4634601,Wholesale of meat and meat and meat products
G,46,463,46346,4634602,Wholesale of slaughtered and derived birds
G,46,463,46346,4634603,Wholesale of fish and seafood
G,46,463,46346,4634699,Wholesale of meat and meat products of other animals
G,46,463,46354,4635401,Wholesale of mineral water
G,46,463,46354,4635402,"Wholesale of beer, draft beer and soda"
G,46,463,46354,4635403,Wholesale of beverages with associated fractioning and conditioning activities
G,46,463,46354,4635499,Wholesale of beverages not specified elsewhere
G,46,463,46362,4636201,Wholesale trade of tobacco benefited
G,46,463,46362,4636202,"Wholesale of cigarettes, cigarillos and cigars"
G,46,463,46371,4637101,"Wholesale trade in roasted, ground and soluble coffee"
G,46,463,46371,4637102,Wholesale Sugar Wholesaler
G,46,463,46371,4637103,Wholesale of oils and fats
G,46,463,46371,4637104,"Wholesale of bread, cakes, biscuits and the like"
G,46,463,46371,4637105,Wholesale trade of pasta products
G,46,463,46371,4637106,Wholesaler of ice creams
G,46,463,46371,4637107,"Wholesale trade of chocolates, confectionery, candies, candies and the like"
G,46,463,46371,4637199,Wholesale trade specializing in other food products
G,46,463,46397,4639701,Wholesale of food products in general
G,46,463,46397,4639702,"Wholesale trade in food products in general, with associated fractioning and conditioning activities"
G,46,464,46419,4641901,Wholesale of textiles
G,46,464,46419,4641902,"Wholesale of bed, table and bathroom articles"
G,46,464,46419,4641903,Wholesale trade of haberdashery
G,46,464,46427,4642701,"Wholesale of clothing and accessories, except professional and security articles"
G,46,464,46427,4642702,Wholesale of clothing and accessories for professional use and work safety
G,46,464,46435,4643501,Wholesale of footwear
G,46,464,46435,4643502,"Wholesale of luggage, luggage and travel goods"
G,46,464,46443,4644301,Wholesale trade in drugs and drugs for human use
G,46,464,46443,4644302,Wholesale trade in drugs and veterinary drugs
G,46,464,46451,4645101,"Wholesale of instruments and materials for medical, surgical, hospital and laboratory use"
G,46,464,46451,4645102,Wholesale of prosthetics and orthopedic articles
G,46,464,46451,4645103,Wholesale of dental products
G,46,464,46460,4646001,Wholesale of cosmetics and perfumery products
G,46,464,46460,4646002,Wholesale of personal hygiene products
G,46,464,46478,4647801,Wholesale of office and stationery goods
G,46,464,46478,4647802,"Wholesale of books, newspapers and other publications"
G,46,464,46494,4649401,Wholesale of electrical equipment for personal and domestic use
G,46,464,46494,4649402,Wholesale of electronic devices for personal and domestic use
G,46,464,46494,4649403,"Wholesale of bicycles, tricycles and other recreational vehicles"
G,46,464,46494,4649404,Wholesale of furniture and bed linen
G,46,464,46494,4649405,Wholesale of tapestry articles; blinds and curtains
G,46,464,46494,4649406,"Wholesale of chandeliers, lamps and lamps"
G,46,464,46494,4649407,"Wholesale of films, CDs, DVDs, tapes and discs"
G,46,464,46494,4649408,"Wholesale of hygiene products, cleaning and home care"
G,46,464,46494,4649409,"Wholesale trade in hygiene products, cleaning and home preservation, with associated fractioning and conditioning activities"
G,46,464,46494,4649410,"Wholesale of jewelry, watches and jewelery, including precious stones and semi-precious stones"
G,46,464,46494,4649499,"Wholesale of other household and personal care articles and equipment, not elsewhere classified"
G,46,465,46516,4651601,Wholesale of computer equipment
G,46,465,46516,4651602,Wholesale of computer supplies
G,46,465,46524,4652400,Wholesale of electronic components and telephone and communication equipment
G,46,466,46613,4661300,"Wholesale of machinery, apparatus and equipment for agricultural use; parts and pieces"
G,46,466,46621,4662100,"Wholesale of machinery, earthmoving, mining and construction equipment; parts and pieces"
G,46,466,46630,4663000,Wholesale of machinery and equipment for industrial use; parts and pieces
G,46,466,46648,4664800,"Wholesale of machinery, apparatus and equipment for dental-medical-hospital use; parts and pieces"
G,46,466,46656,4665600,Wholesale trade of machines and equipment for commercial use; parts and pieces
G,46,466,46699,4669901,Wholesale trade of pumps and compressors; parts and pieces
G,46,466,46699,4669999,Wholesale of other machinery and equipment not elsewhere classified; parts and pieces
G,46,467,46711,4671100,Wholesale of wood and derived products
G,46,467,46729,4672900,Wholesale of hardware and tools
G,46,467,46737,4673700,Wholesale of electrical equipment
G,46,467,46745,4674500,Wholesale of cement
G,46,467,46796,4679601,"Wholesale of paints, varnishes and the like"
G,46,467,46796,4679602,Wholesale trade of marbles and granites
G,46,467,46796,4679603,"Wholesale of glass, mirrors and stained-glass windows"
G,46,467,46796,4679604,Wholesale specialized trade of construction materials nes
G,46,467,46796,4679699,Wholesale of construction materials in general
G,46,468,46818,4681801,"Wholesale trade of fuel alcohol, biodiesel, gasoline and other petroleum products, except lubricants, not carried out by retailer (TRR)"
G,46,468,46818,4681802,Wholesale trade of fuels by retailer (TRR)
G,46,468,46818,4681803,"Wholesale of fuels of vegetable origin, other than fuel alcohol"
G,46,468,46818,4681804,Wholesale of fuels of crude mineral origin
G,46,468,46818,4681805,Wholesale of lubricants
G,46,468,46826,4682600,Wholesaler of liquefied petroleum gas (LPG)
G,46,468,46834,4683400,"Wholesale trade in pesticides, fertilizers, fertilizers and soil improvers"
G,46,468,46842,4684201,Wholesale resins and elastomers
G,46,468,46842,4684202,Wholesale solvents trade
G,46,468,46842,4684299,Wholesale of other chemical and petrochemical products nec
G,46,468,46851,4685100,"Wholesale of steel and metallurgical products, except for construction"
G,46,468,46869,4686901,Wholesale of paper and paperboard
G,46,468,46869,4686902,Wholesale packaging trade
G,46,468,46877,4687701,Wholesale of paper and paperboard waste
G,46,468,46877,4687702,"Wholesale of non-metallic wastes and scrap, except paper and paperboard"
G,46,468,46877,4687703,Wholesale of waste and scrap metal
G,46,468,46893,4689301,"Wholesale of mineral extracts, except for fuels"
G,46,468,46893,4689302,Wholesale trade of yarns and fibers benefited
G,46,468,46893,4689399,"Wholesale trade, specialized in other intermediary products, not elsewhere classified"
G,46,469,46915,4691500,"Wholesale trade of goods in general, with predominance of food products"
G,46,469,46923,4692300,"Wholesale trade of goods in general, with predominance of agricultural inputs"
G,46,469,46931,4693100,"Wholesale trade of goods in general, without predominance of food or agricultural inputs"
G,47,471,47113,4711301,"Retailing of merchandise in general, with predominance of food products - hypermarkets"
G,47,471,47113,4711302,"Retail trade in general merchandise, predominantly food products - supermarkets"
G,47,471,47121,4712100,"Retailing of merchandise in general, with predominance of food products - mini-markets, grocery stores and warehouses"
G,47,471,47130,4713001,Department stores or magazines
G,47,471,47130,4713002,"Variety shops, except department stores or magazines"
G,47,471,47130,4713003,Duty free shops of international airports
G,47,472,47211,4721102,Pre-resale bakery and confectionery
G,47,472,47211,4721103,Retail sale of dairy products and cold cuts
G,47,472,47211,4721104,"Retail sale of sweets, candies, candies and the like"
G,47,472,47229,4722901,Retail sale of meat - butchers
G,47,472,47229,4722902,Fishmonger
G,47,472,47237,4723700,Retail sale of beverages
G,47,472,47245,4724500,Retail sale of fruit and vegetables
G,47,472,47296,4729601,Tabacaria
G,47,472,47296,4729602,Retail trade of goods in convenience stores
G,47,472,47296,4729699,Retail sale of food products in general or specialized in food products
G,47,473,47318,4731800,Retail trade of motor vehicle fuels
G,47,473,47326,4732600,Retailing of lubricants
G,47,474,47415,4741500,Retail sale of paints and paint materials
G,47,474,47423,4742300,Retail sale of electrical equipment
G,47,474,47431,4743100,Retail sale of glass
G,47,474,47440,4744001,Retail hardware and tools retail
G,47,474,47440,4744002,Retail trade of wood and artifacts
G,47,474,47440,4744003,Retail sale of hydraulic materials
G,47,474,47440,4744004,"Retail trade in lime, sand, crushed stone, bricks and tiles"
G,47,474,47440,4744005,Retail sale of construction materials nes
G,47,474,47440,4744006,Retail sale of flooring stones
G,47,474,47440,4744099,Retail sale of general construction materials
G,47,475,47512,4751201,Specialized retailing of computer equipment and supplies
G,47,475,47512,4751202,Refilling cartridges for computer equipment
G,47,475,47521,4752100,Specialized retail trade in telephony and communication equipment
G,47,475,47539,4753900,Specialized retail trade of household appliances and audio and video equipment
G,47,475,47547,4754701,Furniture retail trade
G,47,475,47547,4754702,Retail sale of bed linen
G,47,475,47547,4754703,Retail sale of lighting equipment
G,47,475,47555,4755501,Retailing of fabrics
G,47,475,47555,4755502,Retail trade of haberdashery
G,47,475,47555,4755503,"Retail trade of bed, table and bathroom articles"
G,47,475,47563,4756300,Specialized retail trade of musical instruments and accessories
G,47,475,47571,4757100,"Specialized retail trade in parts and accessories for home appliances, except computers and communication"
G,47,475,47598,4759801,"Retail sale of upholstery products, curtains and blinds"
G,47,475,47598,4759899,Retail sale of other household and personal items not elsewhere classified
G,47,476,47610,4761001,Retailing of books
G,47,476,47610,4761002,Retail sale of newspapers and magazines
G,47,476,47610,4761003,Retail sale of stationery
G,47,476,47628,4762800,"Retail sale of discs, CDs, DVDs and tapes"
G,47,476,47636,4763601,Retailing of toys and recreational items
G,47,476,47636,4763602,Retailing of sporting goods
G,47,476,47636,4763603,Retail trade of bicycles and tricycles; parts and accessories
G,47,476,47636,4763604,"Retail sale of hunting, fishing and camping goods"
G,47,476,47636,4763605,Retail trade of boats and other recreational vehicles; parts and accessories
G,47,477,47717,4771701,Retail sale of pharmaceutical products without manipulation of formulas
G,47,477,47717,4771702,"Retailing of pharmaceuticals, with manipulation of formulas"
G,47,477,47717,4771703,Retail sale of homeopathic pharmaceuticals
G,47,477,47717,4771704,Retail trade in veterinary drugs
G,47,477,47725,4772500,"Retail sale of cosmetics, perfumery and toilet preparations"
G,47,477,47733,4773300,Retail sale of medical and orthopedic articles
G,47,477,47741,4774100,Retail sale of optical goods
G,47,478,47814,4781400,Retail sale of clothing and accessories
G,47,478,47822,4782201,Retailing of footwear
G,47,478,47822,4782202,Retail sale of travel goods
G,47,478,47831,4783101,Retail sale of jewelery articles
G,47,478,47831,4783102,Retail sale of watches and clocks
G,47,478,47849,4784900,Retail sale of liquefied petroleum gas (LPG)
G,47,478,47857,4785701,Retail sale of antiques
G,47,478,47857,4785799,Retail sale of other second-hand goods
G,47,478,47890,4789001,"Retail trade of souvenirs, costume jewelery and handicrafts"
G,47,478,47890,4789002,Retail sale of natural flowers and plants
G,47,478,47890,4789003,Retail sale of art objects
G,47,478,47890,4789004,Retail trade in live animals and articles and pet food
G,47,478,47890,4789005,Retail sale of sanitizing products
G,47,478,47890,4789006,Retail sale of fireworks and pyrotechnic articles
G,47,478,47890,4789007,Retail sale of office equipment
G,47,478,47890,4789008,Retail sale of photographic and cinematographic goods
G,47,478,47890,4789009,Retail trade in arms and ammunition
G,47,478,47890,4789099,Retail sale of other products nec
H,49,491,49116,4911600,Railroad transportation of goods
H,49,491,49124,4912401,Intercity and interstate rail transportation of passengers
H,49,491,49124,4912402,Municipal and metropolitan rail passenger transport
H,49,491,49124,4912403,Subway transportation
H,49,492,49213,4921301,"Collective road transport of passengers, with fixed, municipal route"
H,49,492,49213,4921302,"Collective road transport of passengers, with fixed itinerary, intermunicipal in metropolitan region"
H,49,492,49221,4922101,"Collective road transport of passengers, with fixed itinerary, intermunicipal, except in the metropolitan region"
H,49,492,49221,4922102,"Collective road transport of passengers, with fixed itinerary, interstate"
H,49,492,49221,4922103,"Collective road transport of passengers, with fixed itinerary, international"
H,49,492,49230,4923001,Taxi service
H,49,492,49230,4923002,Passenger transport service - car hire with driver
H,49,492,49248,4924800,School bus
H,49,492,49299,4929901,"Collective road transport of passengers, under charter, municipal"
H,49,492,49299,4929902,"Collective road transport of passengers, under charter, intermunicipal, interstate and international regime"
H,49,492,49299,4929903,"Organization of excursions on own, municipal road vehicles"
H,49,492,49299,4929904,"Organization of excursions on own, intermunicipal, interstate and international road vehicles"
H,49,492,49299,4929999,"Other road passenger transport, not elsewhere classified"
H,49,493,49302,4930201,"Cargo transportation, except dangerous goods and removals, municipal"
H,49,493,49302,4930202,"Cargo road transport, except dangerous products and changes, intermunicipal, interstate and international"
H,49,493,49302,4930203,Road transport of dangerous goods
H,49,493,49302,4930204,Road transport of change
H,49,494,49400,4940000,Ductwork transportation
H,49,495,49507,4950700,"Tourist trains, cable cars and similar"
H,50,501,50114,5011401,Coastal shipping - Freight
H,50,501,50114,5011402,Shipping by cabotage - passengers
H,50,501,50122,5012201,Long-sea shipping - Freight
H,50,501,50122,5012202,Long sea shipping - Passengers
H,50,502,50211,5021101,"Inland freight transport, municipal, except crossing"
H,50,502,50211,5021102,"Transportation by Inland Cargo, Inter-Municipal, Interstate and International Inland Waterways, except Crossing"
H,50,502,50220,5022001,"Inland waterway transport of passengers on regular, municipal lines, except crossings"
H,50,502,50220,5022002,"Inland waterway transport of passengers on regular, intermunicipal, interstate and international lines, except crossings"
H,50,503,50301,5030101,Maritime support navigation
H,50,503,50301,5030102,Port support navigation
H,50,503,50301,5030103,Service of tugboats and pushers
H,50,509,50912,5091201,Transportation by sea
H,50,509,50912,5091202,"Transportation by intercity, interstate and international navigation"
H,50,509,50998,5099801,Water transport for sightseeing
H,50,509,50998,5099899,Other road transport not elsewhere classified
H,51,511,51111,5111100,Regular passenger air transport
H,51,511,51129,5112901,Aerial taxi service and aircraft rental with crew
H,51,511,51129,5112999,Other non-scheduled passenger air transport services
H,51,512,51200,5120000,Air freight transport
H,51,513,51307,5130700,Space transportation
H,52,521,52117,5211701,General warehouses - issue of warrant
H,52,521,52117,5211702,Furniture storage
H,52,521,52117,5211799,"Deposits of goods for third parties, except general stores and furniture storage"
H,52,521,52125,5212500,Loading and unloading
H,52,522,52214,5221400,"Concessionaires of highways, bridges, tunnels and related services"
H,52,522,52222,5222200,Road and rail terminals
H,52,522,52231,5223100,Parking of vehicles
H,52,522,52290,5229001,"Taxi support services, including call centers"
H,52,522,52290,5229002,Vehicle towing services
H,52,522,52290,5229099,Other activities auxiliary to land transport not elsewhere specified
H,52,523,52311,5231101,Administration of port infrastructure
H,52,523,52311,5231102,Port Operator Activities
H,52,523,52311,5231103,Management of waterway terminals
H,52,523,52320,5232000,Maritime agency activities
H,52,523,52397,5239701,Practical services
H,52,523,52397,5239799,Auxiliary activities of water transport not elsewhere classified
H,52,524,52401,5240101,Operation of airports and landing fields
H,52,524,52401,5240199,"Activities auxiliary to air transport, except operation of airports and landing fields"
H,52,525,52508,5250801,Dispatcher
H,52,525,52508,5250802,Customs broker activities
H,52,525,52508,5250803,"Freight forwarding, except for maritime transport"
H,52,525,52508,5250804,Logistics organization of cargo transportation
H,52,525,52508,5250805,Multimodal transport operator - OTM
H,53,531,53105,5310501,National Mail Activities
H,53,531,53105,5310502,Activities of franchisees and permission holders of Correio Nacional
H,53,532,53202,5320201,Pouch services not carried out by the National Post Office
H,53,532,53202,5320202,Fast Delivery Services
I,55,551,55108,5510801,Flights
I,55,551,55108,5510802,Holiday Apartments
I,55,551,55108,5510803,Accommodation
I,55,559,55906,5590601,"Hostels, except charity"
I,55,559,55906,5590602,Campsites
I,55,559,55906,5590603,Bed and Breakfast
I,55,559,55906,5590699,Other accommodation not elsewhere classified
I,56,561,56112,5611201,Restaurants and similar
I,56,561,56112,5611202,Bars and other establishments specializing in serving beverages
I,56,561,56112,5611203,"Snack bars, tea houses, juices and similar"
I,56,561,56121,5612100,Mobile food services
I,56,562,56201,5620101,Supply of pre-prepared food for companies
I,56,562,56201,5620102,Catering services for events and receptions - catering
I,56,562,56201,5620103,Canteens - private food services
I,56,562,56201,5620104,Supply of food prepared predominantly for household consumption
J,58,581,58115,5811500,Book publishing
J,58,581,58123,5812301,Publishing of daily newspapers
J,58,581,58123,5812302,Editing non-daily newspapers
J,58,581,58131,5813100,Publishing of magazines
J,58,581,58191,5819100,"Editing lists, lists and other graphic products"
J,58,582,58212,5821200,Edition integrated with book printing
J,58,582,58221,5822101,Editing integrated with daily newspaper printing
J,58,582,58221,5822102,Editing integrated with the printing of non-daily newspapers
J,58,582,58239,5823900,Integrated editing for magazine printing
J,58,582,58298,5829800,"Editing integrated with the printing of catalogs, lists and other graphic products"
J,59,591,59111,5911101,Cinematographic studios
J,59,591,59111,5911102,Advertising film production
J,59,591,59111,5911199,"Motion picture, video and television program activities not elsewhere classified"
J,59,591,59120,5912001,Security Services
J,59,591,59120,5912002,Sound-mixing services in audiovisual production
J,59,591,59120,5912099,"Post-production activities, film, videos and television programs, not elsewhere classified"
J,59,591,59138,5913800,"Cinematographic, video and television programs distribution"
J,59,591,59146,5914600,Cinematographic exhibition activities
J,59,592,59201,5920100,Sound recording and music publishing activities
J,60,601,60101,6010100,Radio activities
J,60,602,60217,6021700,Open television activities
J,60,602,60225,6022501,Programmers
J,60,602,60225,6022502,"Activities related to pay-TV, except programmers"
J,61,611,61108,6110801,Switched telephone services - STFC
J,61,611,61108,6110802,Telecommunications transport network services - SRTT
J,61,611,61108,6110803,Multimedia communication services - SCM
J,61,611,61108,6110899,Wired telecommunications services nes
J,61,612,61205,6120501,Mobile cellular telephony
J,61,612,61205,6120502,Specialized mobile service - SME
J,61,612,61205,6120599,Wireless telecommunication services nes
J,61,613,61302,6130200,Satellite Telecommunications
J,61,614,61418,6141800,Pay-TV cable operators
J,61,614,61426,6142600,Microwave pay-TV operators
J,61,614,61434,6143400,Pay-TV operators
J,61,619,61906,6190601,Providers of access to communications networks
J,61,619,61906,6190602,Voice over internet protocol providers - VOIP
J,61,619,61906,6190699,Other telecommunications activities not elsewhere classified
J,62,620,62015,6201501,Development of computer programs to order
J,62,620,62015,6201502,Web design
J,62,620,62023,6202300,Development and licensing of customizable computer programs
J,62,620,62031,6203100,Development and licensing of non-customizable computer programs
J,62,620,62040,6204000,Consulting in information technology
J,62,620,62091,6209100,"Technical support, maintenance and other services in information technology"
J,63,631,63119,6311900,"Data processing, application service providers and web hosting services"
J,63,631,63194,6319400,"Portals, content providers and other information services on the internet"
J,63,639,63917,6391700,News Agencies
J,63,639,63992,6399200,"Other information service activities, not elsewhere classified"
K,64,641,64107,6410700,central bank
K,64,642,64212,6421200,Commercial Banks
K,64,642,64221,6422100,Multiple banks with commercial portfolios
K,64,642,64239,6423900,Economical boxes
K,64,642,64247,6424701,Cooperative banks
K,64,642,64247,6424702,Central credit unions
K,64,642,64247,6424703,Mutual Credit Cooperatives
K,64,642,64247,6424704,Rural credit cooperatives
K,64,643,64310,6431000,"Multiple banks, no commercial portfolio"
K,64,643,64328,6432800,Investment Banking
K,64,643,64336,6433600,Development Banks
K,64,643,64344,6434400,Development agencies
K,64,643,64352,6435201,Real Estate Mortgage Companies
K,64,643,64352,6435202,Savings and loan associations
K,64,643,64352,6435203,Mortgage Companies
K,64,643,64361,6436100,"Credit, financing and investment companies - financial"
K,64,643,64379,6437900,Microentrepreneur credit societies
K,64,643,64387,6438701,Exchange banks
K,64,643,64387,6438799,Other non-monetary intermediation institutions not previously specified
K,64,644,64409,6440900,Lease
K,64,645,64506,6450600,Capitalization companies
K,64,646,64611,6461100,Holdings of financial institutions
K,64,646,64620,6462000,Holdings of non-financial institutions
K,64,646,64638,6463800,"Other holding companies, except holdings"
K,64,647,64701,6470101,"Investment funds, except social security and real estate"
K,64,647,64701,6470102,Social security investment funds
K,64,647,64701,6470103,Real estate investment funds
K,64,649,64913,6491300,Trading companies - factoring
K,64,649,64921,6492100,Securitization of credits
K,64,649,64930,6493000,Administration of consortia for the acquisition of goods and rights
K,64,649,64999,6499901,Investment clubs
K,64,649,64999,6499902,Investment Companies
K,64,649,64999,6499903,Credit guarantee fund
K,64,649,64999,6499904,Corporate Financing Boxes
K,64,649,64999,6499905,Granting of credit by OSCIP
K,64,649,64999,6499999,"Other financial service activities, not elsewhere specified or included"
K,65,651,65111,6511101,Life insurance insurance company
K,65,651,65111,6511102,Funeral assistance plans
K,65,651,65120,6512000,Non-life insurance company
K,65,652,65201,6520100,Health insurance insurance company
K,65,653,65308,6530800,Reinsurance
K,65,654,65413,6541300,Closed pension plan
K,65,654,65421,6542100,Supplementary pension plan
K,65,655,65502,6550200,Health insurance
K,66,661,66118,6611801,Stock Exchange
K,66,661,66118,6611802,Stock Exchange
K,66,661,66118,6611803,Stock exchange and futures
K,66,661,66118,6611804,Management of organized over-the-counter markets
K,66,661,66126,6612601,Securities brokers
K,66,661,66126,6612602,Distributors of marketable securities
K,66,661,66126,6612603,Exchange Brokers
K,66,661,66126,6612604,Brokerage of goods contracts
K,66,661,66126,6612605,Investment agents in financial investments
K,66,661,66134,6613400,Credit Card Management
K,66,661,66193,6619301,Settlement and custody services
K,66,661,66193,6619302,Correspondents from financial institutions
K,66,661,66193,6619303,Representations of foreign banks
K,66,661,66193,6619304,ATMs
K,66,661,66193,6619305,Debit Card Operators
K,66,661,66193,6619399,"Other activities auxiliary to financial services, not specified elsewhere"
K,66,662,66215,6621501,Insurance experts and evaluators
K,66,662,66215,6621502,Audit and actuarial consulting
K,66,662,66223,6622300,"Brokers and insurance agents, pension plans and health insurance"
K,66,662,66291,6629100,"Activities auxiliary to insurance, supplementary pension plans and health insurance plans not previously specified"
K,66,663,66304,6630400,Activities of administration of funds by contract or commission
L,68,681,68102,6810201,Purchase and sale of own properties
L,68,681,68102,6810202,Rent of own properties
L,68,681,68102,6810203,Allotment of own properties
L,68,682,68218,6821801,Brokerage in the purchase and sale and evaluation of real estate
L,68,682,68218,6821802,Brokerage in real estate leasing
L,68,682,68226,6822600,Management and administration of real estate
M,69,691,69117,6911701,Attorney services
M,69,691,69117,6911702,Activities auxiliary to justice
M,69,691,69117,6911703,Industrial Property Agent
M,69,691,69125,6912500,Offices
M,69,692,69206,6920601,Accounting activities
M,69,692,69206,6920602,Accounting and tax audit and consulting activities
M,70,702,70204,7020400,"Business and management consultancy activities, except technical consultancy"
M,71,711,71111,7111100,Architectural services
M,71,711,71120,7112000,Engineering services
M,71,711,71197,7119701,"Mapping, surveying and geodetic services"
M,71,711,71197,7119702,Geological survey activities
M,71,711,71197,7119703,Engineering design services related to architecture and engineering
M,71,711,71197,7119704,Services of technical expertise related to occupational safety
M,71,711,71197,7119799,Technical activities related to engineering and architecture not previously specified
